{
  "product": {
    "name": "焕亮修护精华油",
    "category": "Beauty & Skincare",
    "sub_category": "Face Oil",
    "selling_points": [
      "轻盈不黏腻",
      "帮助改善干燥暗沉",
      "适合妆前与夜间护理"
    ],
    "materials": [
      "角鲨烷",
      "霍霍巴籽油",
      "维生素E"
    ],
    "package_includes": [
      "30ml 精华油 x1"
    ]
  },
  "brand": {
    "name": "LUMERA",
    "tagline": "轻润修护，透亮发光",
    "tone": "clean, premium, reassuring",
    "visual_style": [
      "minimal",
      "soft light",
      "premium skincare"
    ]
  },
  "target_market": {
    "locale": "US",
    "language": "zh-CN",
    "audience": "25-40岁关注肌肤状态与精简护肤步骤的女性",
    "price_positioning": "premium",
    "use_cases": [
      "晨间妆前打底",
      "夜间修护",
      "换季干燥期护理"
    ]
  },
  "constraints": {
    "must_include": [
      "突出肤感轻盈",
      "强调日夜可用场景"
    ],
    "must_avoid": [
      "医疗功效表述",
      "绝对化承诺"
    ],
    "image_ratio_preferences": [
      "4:5",
      "1:1"
    ]
  },
  "modules": [
    {
      "id": "m1",
      "type": "hero_banner",
      "objective": "建立高端第一印象并快速传达核心卖点",
      "headline": "一滴润泽，焕现柔亮肤感",
      "subheadline": "轻盈修护精华油，妆前与夜间都适用",
      "priority": 1
    },
    {
      "id": "m2",
      "type": "feature_highlights",
      "objective": "解释产品核心成分与使用收益",
      "body_points": [
        "角鲨烷帮助提升柔润感",
        "霍霍巴籽油带来轻薄包裹感",
        "维生素E帮助日常护理"
      ],
      "priority": 2
    },
    {
      "id": "m3",
      "type": "lifestyle_scene",
      "objective": "展示妆前与夜间护理场景",
      "image_direction": "浴室台面晨间场景 + 夜间 bedside 护肤场景",
      "priority": 3
    }
  ],
  "output_preferences": {
    "deliverables": [
      "module_plan",
      "image_prompts"
    ],
    "image_generation": false
  }
}
